{
  "schema_version": 1,
  "catalog_id": "ms3-young-feminine-candidates-v1",
  "objective": {
    "language": "ja-JP",
    "preferred_presentation": "youthful-feminine",
    "minimum_listenable_variants": 9,
    "maximum_listenable_variants": 12,
    "minimum_families": 4,
    "shortlist_maximum": 4,
    "shortlist_per_family_maximum": 2
  },
  "policy": {
    "extension_route_required": true,
    "terminal_output_is_debug_only": true,
    "one_gpu_lease": true,
    "raw_voice_material_in_git": false,
    "counted_protocol_version": 1,
    "counted_lane": "voice-conversion-only",
    "text_to_speech_requires_accepted_transport_decision": true
  },
  "variants": [
    {
      "variant_id": "qwen3tts-06b-ono-anna",
      "family_id": "qwen3-tts",
      "family_name": "Qwen3-TTS 0.6B CustomVoice",
      "lane": "text-to-speech",
      "variant_kind": "builtin-preset",
      "wave": "second",
      "priority": 20,
      "candidate_role": "deferred",
      "display_name": "Ono Anna - 軽快な日本語女性声",
      "target_presentation": "bright-youthful-feminine",
      "execution_mode": "text-stream",
      "source_label": "official preset Ono_Anna",
      "source_kind": "official-preset",
      "readiness": "deferred",
      "license_state": "reviewed",
      "authorization_state": "official-preset",
      "profile_id": null,
      "expected_profile_hash": null,
      "expected_configuration_hash": null,
      "official_sources": [
        "https://github.com/QwenLM/Qwen3-TTS"
      ],
      "license_notes": "Apache-2.0 code and released model family; retain the official preset identity and model-card terms.",
      "next_gate": "First accept a committed-spoken-text transport ADR and protocol contract; only then build an isolated static TTS profile."
    },
    {
      "variant_id": "qwen3tts-06b-amitaro-yofukashi",
      "family_id": "qwen3-tts",
      "family_name": "Qwen3-TTS 0.6B Base",
      "lane": "text-to-speech",
      "variant_kind": "authorized-reference",
      "wave": "second",
      "priority": 21,
      "candidate_role": "deferred",
      "display_name": "あみたろ・よふかし参照",
      "target_presentation": "soft-youthful-feminine",
      "execution_mode": "text-stream",
      "source_label": "Amitaro yofukashi authorized reference",
      "source_kind": "licensed-material",
      "readiness": "deferred",
      "license_state": "conditional",
      "authorization_state": "review-required",
      "profile_id": null,
      "expected_profile_hash": null,
      "expected_configuration_hash": null,
      "official_sources": [
        "https://github.com/QwenLM/Qwen3-TTS",
        "https://amitaro.net/voice/voice_rule/"
      ],
      "license_notes": "Amitaro permits AI/model training and RVC with attribution; business use has a notice requirement. Record the exact applicable terms before preparing the reference.",
      "next_gate": "After an accepted TTS transport decision, create an authorization record and content-addressed voice-preparation artifact outside Git."
    },
    {
      "variant_id": "qwen3tts-06b-amitaro-runrun",
      "family_id": "qwen3-tts",
      "family_name": "Qwen3-TTS 0.6B Base",
      "lane": "text-to-speech",
      "variant_kind": "authorized-reference",
      "wave": "second",
      "priority": 22,
      "candidate_role": "deferred",
      "display_name": "あみたろ・るんるん参照",
      "target_presentation": "bright-youthful-feminine",
      "execution_mode": "text-stream",
      "source_label": "Amitaro runrun authorized reference",
      "source_kind": "licensed-material",
      "readiness": "deferred",
      "license_state": "conditional",
      "authorization_state": "review-required",
      "profile_id": null,
      "expected_profile_hash": null,
      "expected_configuration_hash": null,
      "official_sources": [
        "https://github.com/QwenLM/Qwen3-TTS",
        "https://amitaro.net/voice/voice_rule/"
      ],
      "license_notes": "Same creator terms as the yofukashi branch; preserve a distinct reference-preparation and variant identity.",
      "next_gate": "After an accepted TTS transport decision, authorize and prepare this reference separately from every other style."
    },
    {
      "variant_id": "cosyvoice3-amitaro-yofukashi",
      "family_id": "fun-cosyvoice3",
      "family_name": "Fun-CosyVoice3 0.5B",
      "lane": "text-to-speech",
      "variant_kind": "authorized-reference",
      "wave": "second",
      "priority": 23,
      "candidate_role": "deferred",
      "display_name": "CosyVoice3・よふかし参照",
      "target_presentation": "soft-youthful-feminine",
      "execution_mode": "text-stream",
      "source_label": "Amitaro yofukashi authorized reference",
      "source_kind": "licensed-material",
      "readiness": "deferred",
      "license_state": "conditional",
      "authorization_state": "review-required",
      "profile_id": null,
      "expected_profile_hash": null,
      "expected_configuration_hash": null,
      "official_sources": [
        "https://github.com/FunAudioLLM/CosyVoice",
        "https://amitaro.net/voice/voice_rule/"
      ],
      "license_notes": "Apache-2.0 code/model family; reference material remains subject to creator attribution and notice terms.",
      "next_gate": "After an accepted TTS transport decision, pin the runtime and Japanese normalization behavior before comparison."
    },
    {
      "variant_id": "cosyvoice3-amitaro-punsuka",
      "family_id": "fun-cosyvoice3",
      "family_name": "Fun-CosyVoice3 0.5B",
      "lane": "text-to-speech",
      "variant_kind": "authorized-reference",
      "wave": "second",
      "priority": 24,
      "candidate_role": "deferred",
      "display_name": "CosyVoice3・ぷんすか参照",
      "target_presentation": "bright-youthful-feminine",
      "execution_mode": "text-stream",
      "source_label": "Amitaro punsuka authorized reference",
      "source_kind": "licensed-material",
      "readiness": "deferred",
      "license_state": "conditional",
      "authorization_state": "review-required",
      "profile_id": null,
      "expected_profile_hash": null,
      "expected_configuration_hash": null,
      "official_sources": [
        "https://github.com/FunAudioLLM/CosyVoice",
        "https://amitaro.net/voice/voice_rule/"
      ],
      "license_notes": "Use only after the exact style material and permitted purpose are recorded; do not infer authorization from another Amitaro style.",
      "next_gate": "After an accepted TTS transport decision, prepare a separate reference identity and screen the stronger style."
    },
    {
      "variant_id": "meanvc2-amitaro-yofukashi",
      "family_id": "meanvc2",
      "family_name": "MeanVC2",
      "lane": "voice-conversion",
      "variant_kind": "authorized-reference",
      "wave": "first",
      "priority": 1,
      "candidate_role": "primary",
      "display_name": "MeanVC2・よふかし参照",
      "target_presentation": "soft-youthful-feminine",
      "execution_mode": "live",
      "source_label": "Amitaro yofukashi authorized reference",
      "source_kind": "licensed-material",
      "readiness": "license-review",
      "license_state": "conditional",
      "authorization_state": "review-required",
      "profile_id": null,
      "expected_profile_hash": null,
      "expected_configuration_hash": null,
      "official_sources": [
        "https://github.com/ASLP-lab/MeanVC2",
        "https://amitaro.net/voice/voice_rule/"
      ],
      "license_notes": "The README claims Apache-2.0, but the reviewed repository snapshot has no LICENSE file and the published checkpoints have no separate terms. Japanese support is unclaimed and output is 16 kHz.",
      "next_gate": "Resolve and record exact code and checkpoint terms, then prove Japanese content preservation and explicit 16-to-48 kHz route handling before Extension eligibility."
    },
    {
      "variant_id": "meanvc2-amitaro-runrun",
      "family_id": "meanvc2",
      "family_name": "MeanVC2",
      "lane": "voice-conversion",
      "variant_kind": "authorized-reference",
      "wave": "first",
      "priority": 2,
      "candidate_role": "primary",
      "display_name": "MeanVC2・るんるん参照",
      "target_presentation": "bright-youthful-feminine",
      "execution_mode": "live",
      "source_label": "Amitaro runrun authorized reference",
      "source_kind": "licensed-material",
      "readiness": "license-review",
      "license_state": "conditional",
      "authorization_state": "review-required",
      "profile_id": null,
      "expected_profile_hash": null,
      "expected_configuration_hash": null,
      "official_sources": [
        "https://github.com/ASLP-lab/MeanVC2",
        "https://amitaro.net/voice/voice_rule/"
      ],
      "license_notes": "The unresolved MeanVC2 code and checkpoint terms apply independently of the separately governed runrun reference; Japanese support remains unclaimed.",
      "next_gate": "Resolve exact code and checkpoint terms, prepare and authorize the runrun reference separately, then pass content preservation, 16-to-48 kHz handling, and Extension route parity."
    },
    {
      "variant_id": "xvc-amitaro-yofukashi",
      "family_id": "x-vc",
      "family_name": "X-VC",
      "lane": "voice-conversion",
      "variant_kind": "authorized-reference",
      "wave": "first",
      "priority": 3,
      "candidate_role": "primary",
      "display_name": "X-VC・よふかし参照",
      "target_presentation": "soft-youthful-feminine",
      "execution_mode": "live",
      "source_label": "Amitaro yofukashi authorized reference",
      "source_kind": "licensed-material",
      "readiness": "route-smoke-passed",
      "license_state": "conditional",
      "authorization_state": "approved-prepared",
      "profile_id": "vc.x-vc.amitaro-yofukashi.v1",
      "expected_profile_hash": "sha256:c0ecb42230214a56afa15b7fc00cf487c7a6623bfb4efaee9783d6dfd4aceaa5",
      "expected_configuration_hash": "sha256:164c6a9b942a04aa299b4b816bbfac3d4ce1f11a285b477f6485ca65792fe022",
      "official_sources": [